[
  {
    "id": "instruction.sme.inline_asm.fadd_f32_predicated",
    "kind": "instruction",
    "isa": "sme",
    "group_path": [
      "sme",
      "inline-asm",
      "beta-path"
    ],
    "display_name": "FADD Z.S predicated",
    "intrinsic_names": [],
    "instruction_names": [
      "FADD"
    ],
    "prototype": "fadd <Zdn>.S, <Pg>/M, <Zdn>.S, <Zm>.S",
    "header": "<arm_sme.h>",
    "feature_macros": [
      "__ARM_FEATURE_SME",
      "__ARM_FEATURE_SVE"
    ],
    "required_function_attributes": [
      "__arm_streaming"
    ],
    "operand_constraints": [
      "Use Pg/M so inactive lanes preserve the destination vector."
    ],
    "immediate_constraints": [],
    "vectorization_role": "sme-inline-beta",
    "tail_policy": "Pg must match active columns in the C row being updated.",
    "usage_template": "__asm__ volatile(\n    \"fadd z2.s, p1/m, z2.s, z3.s\\n\"\n    :\n    :\n    : \"z2\", \"z3\", \"p1\"\n);",
    "correctness_rules": [
      "Use inside an SME streaming function; prefer __arm_streaming on both declaration and definition.",
      "Standalone generated code must not rely on __arm_new(\"za\") unless the target link environment has proven SME ABI support routines.",
      "Compile to assembly and scan for smstart za, zero {za}, fmopa, st1w and smstop za; scan linked output for unresolved __arm_tpidr2_* or __arm_za_disable symbols.",
      "Use for beta == 1 or explicit C += ZA-row style paths after MOVA reads a ZA slice."
    ],
    "anti_patterns": [
      "Adding weak __arm_tpidr2_* or __arm_za_disable stubs to hide missing SME ABI runtime support.",
      "Mixing the inline-asm ZA ownership model with __arm_new(\"za\") in an unverified standalone benchmark.",
      "Using fadd when the BLAS beta coefficient is neither 0 nor 1."
    ],
    "related_items": [
      "instruction.sme.inline_asm.mova_za0h_to_z",
      "instruction.sme.inline_asm.fmla_f32_predicated"
    ],
    "source": {
      "title": "Arm A-profile A64 Instruction Set Architecture / DDI0602",
      "url": "https://developer.arm.com/documentation/ddi0602/latest/SVE-Instructions",
      "section": "FADD (SVE predicated vector form usable in Streaming SVE mode); DDI0602 reference-only when developer.arm.com blocks scripted access.",
      "retrieved_at": "2026-05-12"
    }
  },
  {
    "id": "instruction.sme.inline_asm.fmla_f32_predicated",
    "kind": "instruction",
    "isa": "sme",
    "group_path": [
      "sme",
      "inline-asm",
      "beta-path"
    ],
    "display_name": "FMLA Z.S predicated",
    "intrinsic_names": [],
    "instruction_names": [
      "FMLA"
    ],
    "prototype": "fmla <Zda>.S, <Pg>/M, <Zn>.S, <Zm>.S",
    "header": "<arm_sme.h>",
    "feature_macros": [
      "__ARM_FEATURE_SME",
      "__ARM_FEATURE_SVE"
    ],
    "required_function_attributes": [
      "__arm_streaming"
    ],
    "operand_constraints": [
      "Use Pg/M to update only active C columns after loading old C and reading ZA."
    ],
    "immediate_constraints": [],
    "vectorization_role": "sme-inline-beta",
    "tail_policy": "Pg must match active columns in the C row being updated.",
    "usage_template": "__asm__ volatile(\n    \"mova z2.s, p1/m, za0h.s[w12, 0]\\n\"\n    \"ld1w { z3.s }, p1/z, [%[c_row]]\\n\"\n    \"dup z4.s, %w[beta_bits]\\n\"\n    \"fmla z2.s, p1/m, z3.s, z4.s\\n\"\n    \"st1w { z2.s }, p1, [%[c_row]]\\n\"\n    :\n    : [c_row] \"r\"(c_row),\n      [beta_bits] \"r\"(beta_bits)\n    : \"memory\", \"z2\", \"z3\", \"z4\", \"p1\", \"za\"\n);",
    "correctness_rules": [
      "Use inside an SME streaming function; prefer __arm_streaming on both declaration and definition.",
      "Standalone generated code must not rely on __arm_new(\"za\") unless the target link environment has proven SME ABI support routines.",
      "Compile to assembly and scan for smstart za, zero {za}, fmopa, st1w and smstop za; scan linked output for unresolved __arm_tpidr2_* or __arm_za_disable symbols.",
      "Use for beta != 0 paths as C = ZA + beta * C after MOVA reads the ZA slice.",
      "Preserve beta as an FP32 bit pattern when duplicating it through an integer inline-asm operand."
    ],
    "anti_patterns": [
      "Adding weak __arm_tpidr2_* or __arm_za_disable stubs to hide missing SME ABI runtime support.",
      "Mixing the inline-asm ZA ownership model with __arm_new(\"za\") in an unverified standalone benchmark.",
      "Replacing the direct st1w beta == 0 path with an unnecessary old-C load."
    ],
    "related_items": [
      "instruction.sme.inline_asm.mova_za0h_to_z",
      "instruction.sme.inline_asm.st1w_za0h_s32"
    ],
    "source": {
      "title": "Arm A-profile A64 Instruction Set Architecture / DDI0602",
      "url": "https://developer.arm.com/documentation/ddi0602/latest/SVE-Instructions",
      "section": "FMLA (SVE predicated vector form usable in Streaming SVE mode); DDI0602 reference-only when developer.arm.com blocks scripted access.",
      "retrieved_at": "2026-05-12"
    }
  },
  {
    "id": "instruction.sme.inline_asm.ld1w_f32",
    "kind": "instruction",
    "isa": "sme",
    "group_path": [
      "sme",
      "inline-asm",
      "load"
    ],
    "display_name": "LD1W Z.S predicated",
    "intrinsic_names": [],
    "instruction_names": [
      "LD1W"
    ],
    "prototype": "ld1w { <Zt>.S }, <Pg>/Z, [<Xn|SP>]",
    "header": "<arm_sme.h>",
    "feature_macros": [
      "__ARM_FEATURE_SME",
      "__ARM_FEATURE_SVE"
    ],
    "required_function_attributes": [
      "__arm_streaming"
    ],
    "operand_constraints": [
      "Pg/Z controls active 32-bit lanes and zeroes inactive lanes."
    ],
    "immediate_constraints": [],
    "vectorization_role": "sme-inline-load",
    "tail_policy": "Inactive lanes are zeroed; keep Pg aligned with the corresponding fmopa predicate.",
    "usage_template": "__asm__ volatile(\n    \"ld1w { z0.s }, p0/z, [%[a_work]]\\n\"\n    \"ld1w { z1.s }, p1/z, [%[b_ptr]]\\n\"\n    :\n    : [a_work] \"r\"(a_work),\n      [b_ptr] \"r\"(b_ptr)\n    : \"memory\", \"z0\", \"z1\"\n);",
    "correctness_rules": [
      "Use inside an SME streaming function; prefer __arm_streaming on both declaration and definition.",
      "Standalone generated code must not rely on __arm_new(\"za\") unless the target link environment has proven SME ABI support routines.",
      "Compile to assembly and scan for smstart za, zero {za}, fmopa, st1w and smstop za; scan linked output for unresolved __arm_tpidr2_* or __arm_za_disable symbols.",
      "Load contiguous temporary A and B vectors; make non-unit-stride A columns contiguous before entering the inline asm K loop.",
      "Use the same p0/p1 predicates that drive fmopa row and column participation."
    ],
    "anti_patterns": [
      "Adding weak __arm_tpidr2_* or __arm_za_disable stubs to hide missing SME ABI runtime support.",
      "Mixing the inline-asm ZA ownership model with __arm_new(\"za\") in an unverified standalone benchmark.",
      "Using ld1w with a stride that does not match the packed or contiguous source vector."
    ],
    "related_items": [
      "instruction.sme.inline_asm.fmopa_f32",
      "instruction.sme.inline_asm.whilelo_b32"
    ],
    "source": {
      "title": "Arm A-profile A64 Instruction Set Architecture / DDI0602",
      "url": "https://developer.arm.com/documentation/ddi0602/latest/SVE-Instructions",
      "section": "LD1W (SVE predicated load usable in Streaming SVE mode); DDI0602 reference-only when developer.arm.com blocks scripted access.",
      "retrieved_at": "2026-05-12"
    }
  },
  {
    "id": "instruction.sme.inline_asm.fmopa_f32",
    "kind": "instruction",
    "isa": "sme",
    "group_path": [
      "sme",
      "inline-asm",
      "outer-product"
    ],
    "display_name": "FMOPA ZA.S",
    "intrinsic_names": [],
    "instruction_names": [
      "FMOPA"
    ],
    "prototype": "fmopa <ZAda>.S, <Pn>/M, <Pm>/M, <Zn>.S, <Zm>.S",
    "header": "<arm_sme.h>",
    "feature_macros": [
      "__ARM_FEATURE_SME"
    ],
    "required_function_attributes": [
      "__arm_streaming"
    ],
    "operand_constraints": [
      "ZAda is the destination FP32 ZA tile accumulator.",
      "Pn and Pm independently predicate the row and column source vectors.",
      "Zn.S and Zm.S hold the FP32 source vectors for one K/outer-product step."
    ],
    "immediate_constraints": [
      "The tile selector in za0.s / za1.s must be architectural and assembler-legal."
    ],
    "vectorization_role": "sme-inline-outer-product",
    "tail_policy": "Express M/N tails through Pn/Pm predicates; express K tail by guarding the source loads before fmopa.",
    "usage_template": "__asm__ volatile(\n    \"whilelo p0.s, xzr, %x[row_count]\\n\"\n    \"whilelo p1.s, xzr, %x[col_count]\\n\"\n    \"ld1w { z0.s }, p0/z, [%[a_work]]\\n\"\n    \"ld1w { z1.s }, p1/z, [%[b_ptr]]\\n\"\n    \"fmopa za0.s, p0/m, p1/m, z0.s, z1.s\\n\"\n    :\n    : [a_work] \"r\"(a_work),\n      [b_ptr] \"r\"(b_ptr),\n      [row_count] \"r\"(row_count),\n      [col_count] \"r\"(col_count)\n    : \"memory\", \"p0\", \"p1\", \"z0\", \"z1\", \"za\"\n);",
    "correctness_rules": [
      "Use inside an SME streaming function; prefer __arm_streaming on both declaration and definition.",
      "Standalone generated code must not rely on __arm_new(\"za\") unless the target link environment has proven SME ABI support routines.",
      "Compile to assembly and scan for smstart za, zero {za}, fmopa, st1w and smstop za; scan linked output for unresolved __arm_tpidr2_* or __arm_za_disable symbols.",
      "Only use for GEMM, rank-k or explicit outer-product semantics with a documented ZA tile-to-C mapping.",
      "The row predicate must describe active C rows and the column predicate active C columns for the current tile."
    ],
    "anti_patterns": [
      "Adding weak __arm_tpidr2_* or __arm_za_disable stubs to hide missing SME ABI runtime support.",